Guid,Title,Link,FeedType,DateTime,DescriptionAlt,DescriptionTitle,Category
9.7059461,"At least 8 dead, dozens missing in Indonesian landslide",https://www.cbc.ca/news/world/indonesia-landslide-9.7059461?cmp=rss,World,2026-01-24 01:29:24,landslide in Indonesia ,"In this photo released by the Indonesian National Search and Rescue Agency (BASARNAS), an aerial shot taken using a drone shows an area affected by landslides in Pasir Langu village, in West Bandung district of West Java province, Indonesia on Saturday. ",
9.7059472,Authorities working to identify victims of landslide that hit New Zealand campground,https://www.cbc.ca/news/world/new-zealand-campground-landslide-victims-9.7059472?cmp=rss,World,2026-01-24 01:22:18,landslide destruction,"A damaged house and cars are some of the debris shown Friday from a landslide at Te Araroa, New Zealand.",
9.7059485,Latest Russian attacks on Ukraine kill 1 and wound 31 people amid U.S.-led peace talks,https://www.cbc.ca/news/world/russia-ukraine-attacks-peace-talks-9.7059485?cmp=rss,World,2026-01-24 01:16:26,A man in a toque is wrapped in a reflective blanket designed to keep body heat in while a paramedic dressed in a red uniform wraps his injured hands. A military officer looks on at the scene.,"A paramedic gives first aid to a resident who was injured in a Russian airstrike in Kharkiv, Ukraine, Saturday, Jan. 24, 2026. (AP Photo/Andrii Marienko)",
9.7059465,12-year-old boy dies after shark attack in Australia ,https://www.cbc.ca/news/world/australian-boy-dies-shark-attack-9.7059465?cmp=rss,World,2026-01-24 01:10:15,people walk on beach,"People walk on the sand at North Steyne Beach in Sydney, Tuesday, Jan. 20, 2026, after a series of shark attacks.",
9.7059474,Thousands of flights cancelled as major winter storm moves across the U.S.,https://www.cbc.ca/news/world/us-winter-storm-flights-cancelled-9.7059474?cmp=rss,World,2026-01-24 01:04:02,People are seen bracing in windy snowy weather in a grocery store parking lot.,"Shoppers brave cold weather as they walk in the parking lot of a store during a winter storm Saturday, Jan. 24, 2026, in Arlington, Texas.",
9.7052884,More than water: Calgary infrastructure woes putting pressure on city hall,https://www.cbc.ca/news/canada/calgary/infrastructure-underwater-woes-city-hall-9.7052884?cmp=rss,Calgary,2026-01-24 01:00:00,A construction zone in Calgary's downtown,,
9.7059168,"The more Trump allies covet Alberta, the less popular separatism may get",https://www.cbc.ca/news/canada/calgary/analysis-alberta-separatism-scott-bessent-9.7059168?cmp=rss,Top Stories,2026-01-23 23:00:00,"Blue hat saying ""We're Done, Alberta First""","A person wears an Alberta First hat while signing a petition to have a referendum on Alberta separation in Stony Plain, Alta., on Jan. 22.",
9.7058232,"Once at risk of demolition, this Ontario WW II site will now be restored",https://www.cbc.ca/news/canada/toronto/ontario-ww-ii-site-will-be-restored-9.7058232?cmp=rss,Canada,2026-01-23 22:00:00,The cafeteria at camp 30 has been fenced off due to being in a state of disrepair.,The cafeteria at camp 30 has been fenced off due to being in a state of disrepair.,
9.705346,"N.S. doctors welcome AI note-taking tool, expert says public transparency important",https://www.cbc.ca/news/canada/nova-scotia/ai-scribe-healthcare-9.7053460?cmp=rss,Health,2026-01-23 22:00:00,,Teaching medication costs is not part of the current medical school curriculum. ,
9.7059181,"Comedian Vic Michaelis on their internet talk show, working with Emilia Clarke — and launching an MLM",https://www.cbc.ca/news/entertainment/vic-michaelis-vip-ponies-9.7059181?cmp=rss,Top Stories,2026-01-23 21:00:00,A woman in a ballgown with coiffed hair stands among a group of other women. Behind them is a Christmas tree.,Comedian and actor Vic Michaelis appears as Cheryl in Peacock's Ponies. ,
9.7059108,Carney Liberals return to House of Commons still short of a majority,https://www.cbc.ca/news/politics/carney-minority-parliament-9.7059108?cmp=rss,Top Stories,2026-01-23 21:00:00,A man waves to someone off camera as he walks on an airport tarmack.,"Prime Minister Mark Carney departs Zurich, Switzerland on Wednesday, Jan. 21, 2026, after attending the annual World Economic Forum in Davos. The House of Commons is returning Monday after a holiday hiatus.",
9.7058547,"For Canada and Carney, the end of the old order is just the start",https://www.cbc.ca/news/politics/carney-davos-speech-analysis-9.7058547?cmp=rss,Top Stories,2026-01-23 21:00:00,A man speaks at a podium.,"Canada's Prime Minister Mark Carney speaks during the 56th annual World Economic Forum (WEF) meeting in Davos, Switzerland, January 20, 2026. REUTERS/Denis Balibouse",
9.7055661,Are librarians the key for teaching AI literacy?,https://www.cbc.ca/news/canada/librarians-teach-ai-9.7055661?cmp=rss,Top Stories,2026-01-23 21:00:00,A man in an indoor room points to a large display screen showing the term Generative AI Guide.,"Reece Steinberg, head of library learning services at Toronto Metropolitan University, is seen in fall 2025 teaching one of the school's new AI workshops. ",
9.7058231,Does creatine work for menopausal symptoms? Doctors weigh in,https://www.cbc.ca/news/health/creatine-menopause-second-opinion-9.7058231?cmp=rss,Health,2026-01-23 21:00:00,A man with gray hair and glasses wearing a blue sweater holds up a cloudy bottle with white powder in liquid.,Dr. Mark Tarnopolsky holds up a bottle of creatine powder in water. ,
9.7058795,Hip-hop icon Michie Mee is 'overjoyed' about getting her own Canadian stamp,https://www.cbc.ca/radio/asithappens/michiemee-maestrofreshwes-munzio-stamps-9.7058795?cmp=rss,Top Stories,2026-01-23 21:00:00,"A woman grins brightly as she poses on the red carpet in a long, flowing pink dress, a gold statement choker and matching bracelet, her curly black hair piled on top of her head and cascading to one side. ","TORONTO, ONTARIO - SEPTEMBER 12: Michie Mee attends the ""Black Life: Untold Stories"" premiere during the 2023 Toronto International Film Festival at TIFF Bell Lightbox on September 12, 2023 in Toronto, Ontario. (Photo by Kayla Oaddams/Getty Images)",
9.70587,Most of the Epstein documents still haven't been released. What's going on?,https://www.cbc.ca/news/world/epstein-documents-release-delay-9.7058700?cmp=rss,World,2026-01-23 21:00:00,A man in a suit gestures with his hand as he speaks in front of a sign about Epstein documents,"Ranking member Rep. Robert Garcia (D-CA) speaks during a House Oversight Committee meeting to vote on whether to hold former President Bill Clinton and former Secretary of State Hillary Clinton in contempt of Congress for defying subpoenas to testify in the panel's investigation of the late convicted sex offender Jeffrey Epstein, at the Capitol in Washington, U.S., January 21, 2026.",
9.7059391,Rainy weather delays Alex Honnold's Taipei 101 skyscraper climb by 24 hours,https://www.cbc.ca/news/entertainment/honnold-taipei-skyscraper-climb-delayed-9.7059391?cmp=rss,Top Stories,2026-01-23 14:55:43,A man posing for a photo with his hand under his chin,"Professional climber Alex Honnold poses, Tuesday, Oct. 21, 2025, in Los Angeles. (AP Photo/Marcio Jose Sanchez)",
9.7058988,"From Alberta to the Atlantic provinces, Canada faces a wind-chilled deep freeze this weekend",https://www.cbc.ca/news/canada/canada-cold-weather-9.7058988?cmp=rss,Canada,2026-01-23 14:55:34,"An icy haze lifts up into the air, the city skyline visible through it. ","Cold weather envelops Saskatoon, Saskatchewan on the morning of January 23, 2026",
9.7058568,"'Awful, despicable': Canadian veterans slam Trump's comments about NATO troops",https://www.cbc.ca/news/canada/trump-nato-afghanistan-veterans-9.7058568?cmp=rss,World,2026-01-23 14:05:31,Heavily armed soldiers walk through a narrow avenue amid some low buildings. ,"Canadian troops from 9 Platoon, C Company, PPCLI, patrol Afghan village of Zangadin for Taliban, on June 14, 2006. While in Afghanistan, 158 Canadian Armed Forces members lost their lives.",
9.7059068,"After allegedly killing a ‘rat,’ could Ryan Wedding turn FBI informant himself?",https://www.cbc.ca/news/world/could-ryan-wedding-become-fbi-informant-9.7059068?cmp=rss,Top Stories,2026-01-23 13:09:42,"A tall, bearded man wearing a dark ball cap, a black, hooded puffer vest, jeans and grey shoes stands in front of the open door of an airplane with his eyes closed and his hands cuffed in front of him. People in FBI jackets stand around him.","This still photo taken from video and provided by the FBI shows Ryan Wedding, a former Canadian Olympic snowboarder who is facing charges related to drug trafficking and the killing of a federal witness, being taken off a plane at Ontario International Airport in Ontario, Calif., on Friday, Jan. 23, 2026.",
9.705917,"Child allegedly hidden overseas for 2 years ‘taught to hate’ mother, judge hears at father’s bail hearing ",https://www.cbc.ca/news/canada/calgary/muhammad-rahman-bail-hearing-calgary-9.7059170?cmp=rss,Calgary,2026-01-23 12:08:15,The Calgary courthouse.,"Muhammad Rahman, 62, faces a charge of child abduction for allegedly taking his five-year-old son overseas and cutting off all contact with his estranged wife before being arrested in Mauritius last December.",
9.705904,Gene-edited pigs deemed safe to eat by Health Canada,https://www.cbc.ca/news/health/pigs-crispr-gene-editing-9.7059040?cmp=rss,Health,2026-01-23 11:55:50,Herd of pigs with centre pig looking at the camera.,"Pigs rescued from a flooded farm wait to be transported to another location, in Chiayi, Taiwan July 29, 2025. REUTERS/Ann Wang",
9.7059109,2 dead after U.S. strike on alleged drug boat in Eastern Pacific,https://www.cbc.ca/news/world/us-strike-eastern-pacific-alleged-drug-boat-9.7059109?cmp=rss,World,2026-01-23 11:35:13,"A view of the exterior of a U.S. military building in Doral, Fla.","DORAL, FLORIDA - DECEMBER 12: The United States Southern Command building is seen as Navy Adm. Alvin Holsey is given a Relinquish of Command and Retirement Ceremony at the U.S. Southern Command headquarters on December 12, 2025 in Doral, Florida. Navy Adm. Alvin Holsey stepped down as commander of U.S. Southern Command and relinquished duties to Air Force Lt. Gen. Evan L. Pettus, and will retire after more than 37 years of service in the U.S. Navy. (Photo by Joe Raedle/Getty Images)",
9.7058626,Keeping an eye on the far side of the moon,https://www.cbc.ca/radio/quirks/bobs-blog-far-side-moon-9.7058626?cmp=rss,Technology,2026-01-23 11:30:49,An image of the moon,"This color image of the Moon was taken by the Galileo spacecraft. The near side is to the right, the far side to the left.",
9.7059107,"Quebec revamps its coat of arms, removes British crown",https://www.cbc.ca/news/canada/montreal/monarchy-quebec-coat-of-arms-9.7059107?cmp=rss,Canada,2026-01-23 11:26:44,Je Me Souviens,,
9.705915,"Trump's 'Board of Peace' gets its legitimacy from the UN, an agency he routinely belittles",https://www.cbc.ca/news/world/trump-board-of-peace-united-nations-9.7058836?cmp=rss,World,2026-01-23 11:25:15,A group of people sit on a stage in front of a blue sign that reads Board of Peace.,"U.S. President Donald Trump sits with Argentina's President Javier Milei, Armenia's Prime Minister Nikol Pashinyan, Hungary's Prime Minister Viktor Orban, Bahrain's Minister of the Prime Minister's Court Shaikh Isa bin Salman bin Hamad Al Khalifa, Morocco's Foreign Minister Nasser Bourita, Azerbaijan's President Ilham Aliyev, Bulgaria's Prime Minister Rosen Zhelyazkov, and Indonesia's President Prabowo Subianto, during a charter announcement for Trump's Board of Peace initiative aimed at resolving global conflicts, alongside the 56th annual World Economic Forum (WEF), in Davos, Switzerland, January 22, 2026. REUTERS/Jonathan Ernst",
9.7057091,2 northwest Calgary Co-op grocery stores closing in March,https://www.cbc.ca/news/canada/calgary/coop-grocery-closure-9.7057091?cmp=rss,Calgary,2026-01-23 10:34:52,The exterior of a Co-op grocery store on a winter day,The Calgary Co-op in Sage Hill is one of two grocery stores the company will be closing as of March. ,
9.7058754,Thousands of demonstrators demand ICE leave Minneapolis,https://www.cbc.ca/news/world/minneapolis-clergy-arrest-protest-9.7058754?cmp=rss,World,2026-01-23 10:11:20,"A group of clergy members kneel on the ground, in a line, during a protest in Minneapolis","Police officers stand next to clergy members as they kneel, as people take part in a rally on the day of a general strike to protest U.S. President Donald Trump's deployment of thousands of immigration enforcement officers on the streets of Minneapolis, Minnesota, U.S., January 23, 2026.  REUTERS/Tim Evans",
9.7058651,B.C. mom with Stage 4 cancer says months-long wait to see oncologist put her at risk,https://www.cbc.ca/news/canada/british-columbia/bc-mother-stage-4-cancer-care-wait-times-risk-9.7058651?cmp=rss,Health,2026-01-23 09:09:08,A woman with brown hair poses in front of the legislature with her daughter ,"Sara Gillooly, seen with her 11-year-old daughter Alina, is speaking out about the wait to see an oncologist. ",
9.7058088,Disgraced Winnipeg police officer sentenced to 7 years in prison 'believed he was untouchable',https://www.cbc.ca/news/canada/manitoba/elston-bostock-sentencing-decision-9.7058088?cmp=rss,Canada,2026-01-23 08:30:55,A man in a suit with a flower in the lapel smiles at the camera.,,
9.7058277,'You cannot rewrite history': Minister rebuffs Trump's claims about allies in Afghanistan,https://www.cbc.ca/news/politics/trump-nato-allies-comments-afghanistan-9.7058277?cmp=rss,World,2026-01-23 07:59:00,Soldiers stand silhouetted in front of the setting sun.,"Canadian and American troops on a joint patrol in late June 2011, one of the last conducted by Canadians during the war. Afghan-Canadian advisers were critical to the operations of both armies during combat operations.",
9.7056496,OMG! People are saying it's so cold trees will explode. That viral claim may be overblown,https://www.cbc.ca/news/science/deep-freeze-exploding-trees-explained-9.7056496?cmp=rss,Technology,2026-01-23 07:13:05,A photograph of a snow-covered landscape in the morning sun with a frost covered tree in the centre and more frost-covered trees in the distant background.,"Black ice, morning frost on a tree. Frost, ice, nature. Photo taken in Mandeville, Quebec. December 3, 2025.",
9.7057113,"N.B. report finds herbicides, heavy metals not the cause of 'most' undiagnosed neurological illnesses",https://www.cbc.ca/news/canada/new-brunswick/undiagnosed-neurological-illness-new-brunswick-report-environmental-herbicide-mystery-brain-9.7057113?cmp=rss,Health,2026-01-23 07:04:53,"A man wearing a blazer, seated at a desk, speaking into a microphone, with New Brunswick flags in the background.","Dr. Yves Léger, chief medical officer of health, held a news conference in Fredericton Friday about the report's findings.",
9.7058334,How to watch the Milano-Cortina Olympics opening ceremony on CBC digital platforms,https://www.cbc.ca/sports/olympics/winter/how-to-watch-olympics-on-cbc-digital-platforms-9.7058334?cmp=rss,World,2026-01-23 07:03:20,"Three female, two male CBC broadcasters.","From left to right: Perdita Felicien, Ron MacLean, Andi Petrillo, Anastasia Bucsis and Craig McMorris will lead CBC’s coverage. ",Sports/Olympics/Winter Sports/Alpine Skiing
9.7058329,"Victim 'did not fight back,' judge notes in sentencing killer to 12 years in prison ",https://www.cbc.ca/news/canada/calgary/marshall-rath-victim-dominic-hood-jordan-smith-manslaughter-sentencing-9.7058329?cmp=rss,Calgary,2026-01-23 06:51:52,Concrete apartment building.,"Calgary police found a deceased man believed to be in his mid-20s in the Rocky Mountain Court apartment building in the 200 block of Sixth Avenue S.E. on Tuesday night, Feb. 22, 2022.",
9.7058303,Send us your questions about the extreme cold in your area,https://www.cbc.ca/news/email-cbc-contact-phone-tips-news-story-1.6466536?cmp=rss,Canada,2026-01-23 06:00:44,A man masked in winter,,
9.7057829,Russia shows no sign of compromise as delegations meet in Abu Dhabi,https://www.cbc.ca/news/world/us-russia-ukraine-talks-9.7057829?cmp=rss,World,2026-01-23 05:47:01,"A woman pushes a pram as she walks past an advertising board, which promotes contract military service in the Russian army in Saint Petersburg, Russia January 21, 2026. ","A woman pushes a pram as she walks past an advertising board, which promotes contract military service in the Russian army in Saint Petersburg, Russia January 21, 2026. ",
9.7058239,"Flight cancellations, dangerous road conditions as snowstorm slams GTA",https://www.cbc.ca/news/canada/toronto/toronto-weekend-weather-timeline-9.7058239?cmp=rss,Top Stories,2026-01-23 05:42:54,Rouge Tank in Scarborough barely visible through falling snow,Heavy snow fell near Scarborough's Rouge Tank on Sunday morning as a severe winter storm warning is in effect for the Greater Toronto Area. ,
9.7058143,Calgary man accused of helping Ryan Wedding set up murder seeking bail ,https://www.cbc.ca/news/canada/calgary/allistair-chapman-ryan-wedding-bail-extradition-9.7058143?cmp=rss,Calgary,2026-01-23 05:34:12," a man in a blue police formal uniform speaks at a podium that says department of justice, flanked by a man and a woman ","Royal Canadian Mounted Police (RCMP) Commissioner Michel Duheme speaks with reporters as Deputy Attorney General Todd Blanche, left, and Attorney General Pam Bondi, right, listen during a news conference at the Department of Justice, on Nov. 19, 2025, in Washington.",
9.7058078,Province releases final report on mystery neurological illness,https://www.cbc.ca/player/play/9.7058078?cmp=rss,Health,2026-01-23 05:08:24,"Split-screen image featuring a man in a blazer and button-down shirt speaking into a microphone on the left, and a series of medical brain scans showing cross-sections of a human head on the right.",,
9.7057905,"Closure of Porter Airlines crew bases to affect 60 pilots in Thunder Bay, Ont., and Halifax, N.S.",https://www.cbc.ca/news/canada/thunder-bay/porter-airlines-pilots-9.7057905?cmp=rss,Canada,2026-01-23 05:00:00,,A Porter Airlines aircraft taxis on the runway at Billy Bishop Toronto City Airport in Toronto on Friday June 28 2013.  Photographer: Brent Lewin/Bloomberg,
9.7058082,Trump cabinet member weighs in on Alberta separatism,https://www.cbc.ca/news/canada/calgary/trump-cabinet-member-weighs-in-on-alberta-separatism-9.7058082?cmp=rss,Calgary,2026-01-23 04:48:18,late middle aged white man in a blue suit and blue striped tie stands and speaks with his hands held out in front,"U.S. Treasury Secretary Scott Bessent speaks at the USA House during the annual meeting of the World Economic Forum in Davos, Switzerland, on Jan. 21, 2026. ",
9.7057845,First Nations chiefs demand answers over Alberta pipeline deal that doesn't mention water,https://www.cbc.ca/news/canada/edmonton/first-nations-water-oilsands-9.7057845?cmp=rss,Canada,2026-01-23 04:27:00,An aerial shot of a tailings pond.,"A view from a helicopter of the tailings ponds at the Kearl Oil Sands Project near Fort McMurray, Alberta.",
9.7057996,Brrr! Why a polar vortex is causing extreme cold in Canada,https://www.cbc.ca/kidsnews/post/watch-brrrr-why-a-polar-vortex-is-causing-extreme-cold-in-canada?cmp=rss,Top Stories,2026-01-23 04:05:23,"A person wearing a dark green parka with a fur-lined hood, bright orange pants, and a neon yellow backpack walks along a paved path in front of a snow-covered hill under a clear blue sky.","A pedestrian makes their way past Citadel Hill as a mass of Arctic air continues to bring extreme cold temperatures across Eastern Canada on Wednesday, January 22, 2025. THE CANADIAN PRESS/Darren Calabrese",
9.7057758,U.S. attorney general confirms accused drug trafficker Ryan Wedding in custody,https://www.cbc.ca/player/play/9.7057758?cmp=rss,Canada,2026-01-23 04:00:00,,,
9.7057839,"Stars, fans arrive in Rome for fashion icon Valentino's funeral",https://www.cbc.ca/news/entertainment/valentino-funeral-9.7057839?cmp=rss,World,2026-01-23 03:29:48,A group of people stand outdoors behind a temporary balustrade. One is holding a poster that shows a waving man in a suit. Above the picture are the words 'Addio Valentino.' Below are the words 'Ultimo Imperatore della Moda.',"People stand outside the Basilic of Santa Maria degli Angeli e dei Martiri during the funeral ceremony for the late Italian fashion designer Valentino Gavarani in Rome on Jan. 23, 2026",
9.7057775,Edmonton long-term care home battling prolonged mice infestation,https://www.cbc.ca/news/canada/edmonton/alta-health-mice-9.7057775?cmp=rss,Calgary,2026-01-23 03:16:53,A winter view of a hospital-like building with a parking lot and building sign in view,"Edmonton General Continuing Care Centre is pictured in downtown Edmonton, on Thursday, Jan. 22, 2026. ",
9.7057753,Canadian fugitive Ryan Wedding arrested after a decade on the run,https://www.cbc.ca/news/world/livestory/ryan-wedding-arrest-jan23-9.7057753?cmp=rss,World,2026-01-23 02:43:46,A bearded man is walked out of a plane by FBI agents,"Canadian Ryan Wedding, 44, was arrested in Mexico City yesterday and is now in custody in the U.S.",
9.7057601,"Couple believed 'skeletal' boy had eating disorder but was never diagnosed, Ontario murder trial told",https://www.cbc.ca/news/canada/hamilton/livestory/cooney-hamber-murder-trial-milton-9.7057601?cmp=rss,Top Stories,2026-01-23 01:48:15,A court sketch of a woman in a prisoners box looking down. ,Becky Hamber is seen in the witness box at the murder trial for her and wife Brandy Cooney. Both have pleaded not guilty.,
9.7057635,Property controls hindering competition in the grocery sector ,https://www.cbc.ca/player/play/9.7057635?cmp=rss,Top Stories,2026-01-23 01:31:59,A customer shopping in the produce section of a grocery story,"Loblaws customers shop at a Toronto-area grocery store on March 6, 2025.",
9.7057618,This new equipment at Canada's Smartest Kitchen in P.E.I. will help food innovators,https://www.cbc.ca/player/play/9.7057618?cmp=rss,Technology,2026-01-23 01:08:00,A man in a test kitchen holds metal gadgets.,Canada's Smartest Kitchen in P.E.I. purchased some new equipment to help entrepreneurs develop food and beverage products. ,
9.7052263,Can't wait to get divorced? Albertans may be able to get it done faster due to protocol change,https://www.cbc.ca/news/canada/calgary/alberta-family-law-changes-9.7052263?cmp=rss,Calgary,2026-01-23 01:00:00,"Human hand signing divorce contract, close-up. Wedding rings with marriage contract and judge gavel on a background","Human hand signing divorce contract, close-up. Wedding rings with marriage contract and judge gavel on a background",
9.7056631,A B.C. property owner found 2 skulls while digging a garden. They didn’t expect the fees that followed,https://www.cbc.ca/news/canada/british-columbia/kamloops-remains-archaeology-development-9.7056631?cmp=rss,Top Stories,2026-01-23 01:00:00,An empty sandy lot surrounded by houses,A B.C. lawyer is raising concerns about the costs incurred by property owners when archaeological sites are found on their land.,
9.7057129,Unique wrestling show returns to Calgary as part of High Performance Rodeo,https://www.cbc.ca/arts/lucha-vavoom-calgary-9.7057129?cmp=rss,Calgary,2026-01-23 01:00:00,"Two women, one in turquoise outfit and mask, the other in a sequined jumpsuit, and one man (black wrestling mask, black and turquoise tights) stand on the ropes of a wrestling ring and flex.","Pro-wrestlers Taya Valkyrie (R), Extreme Tiger (C) and Dama Fina (L) as part of Lucha VaVOOM at the Mayan Theater, in Los Angeles, California, on Feb. 11, 2022.",
9.7057576,"Ontario hospitals are cutting costs amid deficits, but say 'there are no easy choices left'",https://www.cbc.ca/news/canada/toronto/hospital-association-low-risk-cuts-9.7057576?cmp=rss,Health,2026-01-23 00:58:17,A hospital building in the middle of busy downtown Toronto.,Aerial (drone) images of hospitals on University Ave,
9.7056999,Climbers say 'it's just nuts' as Alex Honnold prepares to ascend skyscraper on livestream,https://www.cbc.ca/news/canada/london/climbers-say-it-s-just-nuts-as-alex-honnold-prepares-to-ascend-skyscraper-on-livestream-9.7056999?cmp=rss,Canada,2026-01-23 00:42:04,"Man stands in front of a rock climbing junction, wearing a white T-Shirt and harness. ",Sam Douglas is an avid follower of Alex Honnold. He believes Honnold's endurance levels will help him succeed at his attempt to climb Taipei 101. ,
9.7057574,"More than 5,000 killed in recent protests in Iran, rights group says, as regime rejects Trump claims",https://www.cbc.ca/news/world/iran-protests-death-toll-trump-claims-9.7057574?cmp=rss,World,2026-01-23 00:41:07,"Burnt objects and debris are shown on the ground, along with several red, green and white flags.","This photograph taken during a tour for foreign media shows a videographer taking images of the wreckage at the Al-Aqsa Mosque that was damaged during recent public protests, in Tehran on January 21, 2026. Demonstrations sparked in late December by anger over economic hardship exploded into protests widely seen as the biggest challenge to the Iranian leadership in years. Limited internet access briefly returned in Iran before dropping again, a monitor said January 18, 10 days into a communications blackout that rights groups said aimed to mask a protest crackdown that killed thousands. (Photo by ATTA KENARE / AFP via Getty Images)",
