Guid,Title,Link,FeedType,DateTime,DescriptionAlt,DescriptionTitle,Category
9.7085516,Red Deer's high school academy aims to spark interest in firefighting careers,https://www.cbc.ca/news/canada/edmonton/red-deer-fire-fighting-academy-rural-volunteering-on-call-recruitment-concerns-9.7085516?cmp=rss,Calgary,2026-02-12 03:00:00,Students in firefighting clothes and helmets stand together.,20 Students from across the public school board spend a term in the academy.,
9.7085976,"Canadian mining company employees worked amid gunfire, Mexican cartel checkpoints, says family member",https://www.cbc.ca/news/world/mexico-canada-mining-9.7085976?cmp=rss,World,2026-02-12 02:06:32,A soldier with a very large machine gun sits in the back of a pick-up truck.,"Mexican Marines posted near the entrance to the site in El Verde, Sinaloa, where the bodies of five kidnapped workers for Canadian mining company Vizsla Silver were found.",
9.7085661,"Caregivers in region with Canada's oldest demographic call for more respite, seniors care",https://www.cbc.ca/news/canada/british-columbia/oceanside-caregivers-petition-respite-seniors-care-9.7085661?cmp=rss,Health,2026-02-12 02:00:00,"An older woman uses a walker in a room with a large window, dining tables to the right and chairs to the left.",Retirement Concepts owns 24 seniors care facilities in B.C. and Alberta.,
9.7085261,"Canada regains scoring touch, defence in 5-0 win over Finns in Olympic women's hockey",https://www.cbc.ca/sports/olympics/winter/hockey/olympics-womens-hockey-canada-finland-february-12-9.7085261?cmp=rss,Canada,2026-02-12 01:22:10,Three Canadian female hockey players. ,"Emily Clark, right, celebrates her goal with teammates at the Milano Rho Ice Hockey Arena on Thursday. ",
9.707872,Price check: The staggering stats behind Alberta's rising grocery bills,https://www.cbc.ca/news/canada/edmonton/alberta-grocery-prices-inflation-9.7078720?cmp=rss,Calgary,2026-02-12 01:00:00,"A man stands at a supermarket meat section with his back to the camera, looking at the packaged meat. ","Groceries are pictured in a Vaughan, Ont., supermarket on Aug. 16, 2022. Canada's inflation rate fell to 7.6 per cent in July, according to a report Tuesday from Statistics Canada, marking the first time in 12 months that the rate has decreased from the previous month.",
9.7083031,"Used sleds, crumbling venues, crushing costs, Canada's path back to bobsled success is an uphill climb",https://www.cbc.ca/sports/olympics/winter/bobsleigh/milano-cortina-olympics-canada-bobsled-rebuild-morgan-campbell-feb11-9.7083031?cmp=rss,Calgary,2026-02-12 00:42:04,Bobsledders at the start.,"LAKE PLACID, NEW YORK - MARCH 15: Taylor Austin, Mike Evelyn Keaton Bruggeling and Shaq Lawrence-Murray of Canada compete in heat 3 of the 4-man-bobsleigh on day six of the 2025 IBSF World Championships at Mt Van Hoevenberg on March 15, 2025 in Lake Placid, New York.  (Photo by Maddie Meyer/Getty Images)",
9.7083806,Even this 'construction guy' is 'blown away' by Calgary's home reno costs,https://www.cbc.ca/news/canada/calgary/home-reno-costs-rising-9.7083806?cmp=rss,Calgary,2026-02-12 00:00:00,A residential street has been left with a gaping hole as a number of new infill homes are being built in the background in southwest Calgary.,"New homes being built in the inner-city community of Shaganappi, where development rules are not as restrictive as they are in many suburban neighbourhoods.",
9.7081335,"Welland hospital closing its long-term care home, saying building doesn't meet safety standards",https://www.cbc.ca/news/canada/hamilton/welland-long-term-care-unit-closing-june-2026-9.7081335?cmp=rss,Health,2026-02-12 00:00:00,entrance of hospital unit in winter,Niagara Health announced it will not renew its licence to keep Welland Hospital's extended and interim long-term care units open beyond June.,
9.7084854,Company behind proposed sand mining project partnering with U of Manitoba on groundwater monitoring research,https://www.cbc.ca/news/canada/manitoba/sio-silica-umanitoba-research-9.7084854?cmp=rss,Technology,2026-02-11 23:00:00,A human hand cupping fine granules of sand.,Alberta sand mining company Sio Silica has filed a new application to extract silica sand from below the surface of southeastern Manitoba.,
9.7085641,Rollout of electronic medical records undergoing changes after concerns raised,https://www.cbc.ca/news/canada/nova-scotia/one-person-one-record-electronic-medical-records-health-care-9.7085641?cmp=rss,Health,2026-02-11 22:00:00,A woman with glasses stands in a doorway.,Tanya Nixon is a vice-president at Nova Scotia Health assigned to the One Person One Record project.,
9.7086013,Ukrainian athlete Vladyslav Heraskevych out of Winter Olympics over banned helmet,https://www.cbc.ca/sports/olympics/winter/vladyslav-heraskevych-out-of-winter-olympics-9.7086013?cmp=rss,Top Stories,2026-02-11 21:34:13,athlete competes at Olympics,"Ukraine's Vladyslav Heraskevych starts for a men's skeleton training session at the 2026 Winter Olympics, in Cortina d'Ampezzo, Italy, Wednesday, Feb. 11, 2026.",
9.7082468,Neighbours raise safety concerns after squatters take up shelter in vacant downtown St. John's home,https://www.cbc.ca/news/canada/newfoundland-labrador/neighbours-raise-safety-concerns-after-squatters-take-up-shelter-in-vacant-downtown-st-john-s-home-9.7082468?cmp=rss,Top Stories,2026-02-11 21:30:00,An aerial view of the back of Gower Street. ,"Neighbours reported seeing footprints in the snow going through backyards on Gower Street, leading to a vacant property in the middle of the row of houses. ",
9.7084966,Iranian students in Canada seeking support amid unrest back home,https://www.cbc.ca/news/canada/ottawa/iranian-students-in-canada-seeking-support-amid-unrest-back-home-9.7084966?cmp=rss,Canada,2026-02-11 21:00:00,"A person in winter mitts holds up a sign reading ""DIGITAL BLACKOUT IN IRAN"" ",Queen's University student Aila Payroveolia has organized protests in support of the Iranian people. ,
9.7083649,Trump administration scraps legal basis for climate regulation in U.S.,https://www.cbc.ca/news/science/endangerment-finding-trump-us-climate-emissions-9.7083649?cmp=rss,Top Stories,2026-02-11 21:00:00,Pollution rises from a power plant against a red sunset.,"The Jeffrey Energy Center coal-fired power plant operates at sunset near Emmett, Kan., Saturday, Jan. 3, 2026, in Topeka, Kan. (AP Photo/Charlie Riedel)",
9.7085353,"As schools process Tumbler Ridge shooting, officials say safety protocols need ongoing attention",https://www.cbc.ca/news/canada/schools-safety-protocols-procedures-9.7085353?cmp=rss,Top Stories,2026-02-11 21:00:00,"A video screen capture shows students, with their arms raised, filing out from a school building past a parking lot.","A total of 10 people are dead after a pair of shootings Tuesday in the tiny community of Tumbler Ridge in B.C.'s Peace region. The community went into a lockdown that lasted several hours, after police were called about an active shooter at Tumbler Ridge Secondary School. In this still from a video provided to the Associated Press from the scene, students are seen being escorted out of the school with their hands in the air. THE CANADIAN PRESS/AP-Jordon Kosik",
9.7085201,Quebec abortion pill prescriptions jump 80% as access barriers fall,https://www.cbc.ca/news/canada/montreal/abortion-pill-quebec-increase-9.7085201?cmp=rss,Health,2026-02-11 21:00:00,A medication box,"A total of 2,852 women were reimbursed for taking Mifegymiso in Quebec last year, compared to 1,586 in 2024. Experts say the increase in prescriptions for the abortion pill is good news, in part due to its safety. ",
9.7085206,"As tensions simmer between U.S. and Iran, Iraq is feeling the heat",https://www.cbc.ca/news/world/us-iran-iraq-al-maliki-9.7085206?cmp=rss,World,2026-02-11 21:00:00,"A man in glasses, waving.","Former Iraqi Prime Minister Nouri al-Maliki leaves after casting his ballot at a polling station in Baghdad on November 11, 2025 during Iraq's parliamentary elections. Iraq is holding parliamentary elections, with analysts saying Iran will be watching closely as it hopes to retain influence over its neighbour after losing regional leverage during the Gaza war.",
9.7084928,"Ottawa commits to keeping Mounties on front lines, says fixing federal policing is priority",https://www.cbc.ca/news/politics/rcmp-policing-reforms-9.7084928?cmp=rss,Canada,2026-02-11 21:00:00,"An RCMP officer is red serge in Richmond, B.C., on Thursday, April 10, 2025.","An RCMP officer is red serge in Richmond, B.C., on Thursday, April 10, 2025.",
9.7085529,Ambassador Bridge owners ramped up lobbying before Trump’s Gordie Howe threats ,https://www.cbc.ca/news/canada/windsor/trump-gordie-howe-moroun-bridge-lobby-ambassador-ballard-9.7085529?cmp=rss,Top Stories,2026-02-11 21:00:00,A man wearing a suit.,Matthew Moroun appears in a 2018 file photo. ,
9.7065039,"Owner of St. Catharines, Ont., café fought Enbridge over $56K gas bill error — and won",https://www.cbc.ca/news/canada/hamilton/small-cafe-enbridge-gas-bill-9.7065039?cmp=rss,Top Stories,2026-02-11 21:00:00,man with glasses standing in front of coffee shop counter,"Ritesh Kumar, owner of Christopher's Cafe in St. Catharines, is still disputing a $56,589 gas charge from Enbridge two years after his first complaint.",
9.7085078,"After Tumbler Ridge shooting, false claims about trans people have proliferated online",https://www.cbc.ca/news/canada/tumbler-ridge-shooting-trans-community-false-claims-9.7085078?cmp=rss,Calgary,2026-02-11 16:04:55,Police tape,"Police could be seen leaving and going to the Tumbler Ridge Secondary School throughout the morning in Tumbler Ridge, B.C. on Wednesday, Feb. 11, 2026. THE CANADIAN PRESS/Jesse Boily",
9.7085467,Central Alberta town faces uncertain future as it drowns in debt and faces potential insolvency ,https://www.cbc.ca/news/canada/edmonton/gibbons-alberta-finances-future-9.7085467?cmp=rss,Calgary,2026-02-11 15:23:51,,The chief administrative officer for the Town of Gibbons has come up with a novel way for the town to raise money for infrastructure.,
9.7085766,Alberta petition questioning public funding for private schools fails to meet organizers' goal,https://www.cbc.ca/news/canada/edmonton/alberta-petition-public-funding-private-schools-9.7085766?cmp=rss,Calgary,2026-02-11 15:02:03,"woman in red standing at podium, sign saying Alberta Funds Public Schools",Petition proponent Alicia Taylor addressed reporters outside Elections Alberta in Edmonton on Wednesday.,
9.7085808,Kraft Heinz halts plans to split company,https://www.cbc.ca/news/business/kraft-heinz-halts-company-split-9.7085808?cmp=rss,Business,2026-02-11 14:25:05,"A sign with the Kraft Heinz logo on it, with a snow-covered parking lot in the background","A sign shows the company's logo at the Kraft Heinz facility in Lowville, N.Y., on Wednesday, Feb. 11, 2026. (AP Photo/Cara Anna)",
9.7085808,Kraft Heinz halts plans to split company,https://www.cbc.ca/news/business/kraft-heinz-halts-company-split-9.7085808?cmp=rss,Business,2026-02-11 14:25:05,"A sign with the Kraft Heinz logo on it, with a snow-covered parking lot in the background","A sign shows the company's logo at the Kraft Heinz facility in Lowville, N.Y., on Wednesday, Feb. 11, 2026. (AP Photo/Cara Anna)",
9.7085781,"The fastest way to get into an Ontario LTC is by going to a hospital first. That's a problem, say advocates",https://www.cbc.ca/news/canada/toronto/ontario-long-term-care-9.7085781?cmp=rss,Health,2026-02-11 14:01:31,"Woodstock General Hospital is seen in Woodstock, Ont., Thursday, May 22, 2025. THE CANADIAN PRESS/Nicole Osborne","Woodstock General Hospital is seen in Woodstock, Ont., Thursday, May 22, 2025. THE CANADIAN PRESS/Nicole Osborne",
9.7085424,Olympic viewing guide Day 6: Get ready for a big Thursday,https://www.cbc.ca/sports/olympics/winter/the-buzzer-newsletter-day6-lookahead-feb11-9.7085424?cmp=rss,Canada,2026-02-11 12:57:38,A speed skater competes.,"William Dandjinou of Canada leads his heat while competing in the men's 1000 meter short track speed skating at the 2026 Winter Olympics, in Milan, Italy, Tuesday, Feb. 10, 2026. (AP Photo/Francisco Seco)",Sports
9.7085462,CMHC warns full repeal of blanket rezoning could put Calgary's federal housing funding at risk,https://www.cbc.ca/news/canada/calgary/chmc-blanket-rezoning-repeal-housing-funding-9.7085462?cmp=rss,Calgary,2026-02-11 12:55:50,Homes under construction,A report from City of Calgary staff warns a combined $861 million in federal funding could be at risk if council goes ahead with repealing blanket rezoning.,
9.7085071,Canadian skaters Gilles and Poirier find peace with an Olympic medal moment a lifetime in the making,https://www.cbc.ca/sports/olympics/winter/figure-skating/milano-cortina-canada-ice-dance-figure-skating-chris-jones-feb11-9.7085071?cmp=rss,Canada,2026-02-11 12:38:13,Figure skaters react to their scores.,"Piper Gilles and Paul Poirier of Canada react to their scores after competing during the ice dancing free skate in figure skating at the 2026 Winter Olympics, in Milan, Italy, Wednesday, Feb. 11, 2026. (AP Photo/Stephanie Scarbrough)",
9.7085625,"Boy, 13, who stabbed little brother handed 3-year sentence designed for youth with mental health issues",https://www.cbc.ca/news/canada/calgary/lethbridge-youth-stabbed-brother-attempted-murder-sentence-9.7085625?cmp=rss,Canada,2026-02-11 12:11:05,A police officer walks into a courthouse.,"A police officer arrives at the provincial court building where the first court appearance of Derek James Saretzky in Lethbridge, Alta., Wednesday, Sept. 23, 2015. Saretzky, a southern Alberta man accused of killing a two-year-old girl and her father last September, is facing a new charge of first-degree murder. RCMP say Saretzky is accused in the death of Hanne Meketech, whose body was found in her Coleman, Alta., home on Sept. 9, 2015. ",
9.7085561,Mayor of Portapique tells Tumbler Ridge 'we understand' mass shooting devastation,https://www.cbc.ca/player/play/9.7085561?cmp=rss,Canada,2026-02-11 12:09:44,Y POWER AND POLITICS WEDNESDAY CLEAN PG412T_frame_83254,Y POWER AND POLITICS WEDNESDAY CLEAN PG412T_frame_83254,
9.7085415,Sask. mine that could make Canada world's biggest uranium exporter faces last hurdle,https://www.cbc.ca/news/canada/saskatchewan/sask-uranium-mine-nexgen-hearing-9.7085415?cmp=rss,Canada,2026-02-11 11:39:57,An aerial shot of a patch of boreal forest cut through with service roads and future building sites.,"The proposed site for NexGen Energy Ltd.'s Rook I Project, located 130 kilometres north of La Loche, Sask. It still requires federal approval.",
9.7085557,"Text exchange that brought down Quebec Liberal leader was doctored, report finds",https://www.cbc.ca/player/play/9.7085557?cmp=rss,Canada,2026-02-11 11:25:48,A photo of Pablo Rodriguez is put over a graphic showing a text message conversation,,
9.7085247,"No need to panic about warmer temperatures stressing Calgary flora, experts say",https://www.cbc.ca/news/canada/calgary/calgary-warm-weather-february-plants-trees-9.7085247?cmp=rss,Calgary,2026-02-11 10:56:05,Close-up of a yellow flower and green plants.,"Plants are seen at Golden Acre Home & Garden in Calgary on Feb. 11, 2026. Some local horticulturalists say the recent spell of warm weather is not a threat for trees and plants coming out of hibernation too soon.",
9.7085335,Trump meets with Netanyahu as Iran marks 47 years of Islamic rule,https://www.cbc.ca/player/play/9.7085335?cmp=rss,World,2026-02-11 10:05:19,two men shake hands,"U.S. President Donald Trump met with Israeli Prime Minister Benjamin Netanyahu in Washington to discuss U.S. nuclear talks with Iran, but nothing definitive was decided.",
9.70852,"Suspect's mother identified as 1 of 8 Tumbler Ridge, B.C., mass shooting victims",https://www.cbc.ca/news/canada/british-columbia/suspect-s-mother-victim-tumbler-ridge-mass-shooting-9.7085200?cmp=rss,Canada,2026-02-11 10:01:13,A woman with a ponytail smiles.,"Jennifer Strang, 39, was killed in a mass shooting in Tumbler Ridge, B.C., on Feb. 10, 2026. She has been identified as the mother of the shooting's suspect, 18-year-old Jesse Van Rootselaar. ",
9.7083309,"Yes, Canada has a 'fungus bank' — and it just got saved by a massive donation",https://www.cbc.ca/news/science/fungal-biobank-9.7083309?cmp=rss,Health,2026-02-11 09:31:51,james scott,"Researcher James Scott, director of the UAMH Centre for Global Microfungal Biodiversity in Toronto, stands among the centre's drawers of fungal specimens. The fungal biobank has been saved by a $1 million donation from the Weston Family Foundation.",
9.7084958,Ukrainian Vladyslav Heraskevych is the most important athlete at the Olympics right now,https://www.cbc.ca/sports/olympics/winter/milano-cortina-olympics-richard-deitsch-notebook-feb11-9.7084958?cmp=rss,World,2026-02-11 09:25:16,An athlete talks to media.,"Ukraine's Vladyslav Heraskevych, left, talks to the media during a men's skeleton training session at the 2026 Winter Olympics, in Cortina d'Ampezzo, Italy, Wednesday, Feb. 11, 2026. (AP Photo/Alessandra Tarantino)",
9.7085047,"P.E.I. school officials didn’t mishandle complaints about substitute teacher, 3rd-party review finds",https://www.cbc.ca/news/canada/prince-edward-island/pei-school-officials-matthew-craswell-complaints-jenkins-review-9.7085047?cmp=rss,Canada,2026-02-11 08:34:54,A man sitting in a chair in an office speaks with a female reporter with a TV camera in the foreground.,"Former P.E.I. chief justice David Jenkins is interviewed by CBC's Nicola MacLeod on Feb. 11, 2026.",
9.7085108,Vonn says she had 'successful' 3rd surgery on broken leg following alpine crash at Olympics,https://www.cbc.ca/sports/olympics/winter/alpine-skiing/lindsey-vonn-successful-3rd-surgery-9.7085108?cmp=rss,World,2026-02-11 08:16:36,A women's alpine skier crashes.,Lindsey Vonn crashes during the women's downhill on Day 2 of the Milano Cortina 2026 Winter Olympics.,
9.7085053,Dawson's Creek star James Van Der Beek dead at 48,https://www.cbc.ca/news/entertainment/james-van-der-beek-obit-dawsons-creek-9.7085053?cmp=rss,Top Stories,2026-02-11 07:53:46,Blong haired man smiling ,"James Van Der Beek attends FOX Winter Press Day on Monday, Nov. 18, 2024, at the FOX Studio Lot in Los Angeles. ",
9.7084807,Community of Tumbler Ridge mourning victims of mass shooting,https://www.cbc.ca/player/play/9.7084807?cmp=rss,Canada,2026-02-11 06:15:24,Nicole Oud,,
9.7083474,Some Greenlandic Inuit say work on independence from Denmark will come amidst fight against U.S. threats,https://www.cbc.ca/news/canada/north/greenlandic-inuit-independence-denmark-us-9.7083474?cmp=rss,World,2026-02-11 06:00:00,A man wearing a puffer jacket holds the Greenlandic flag among a crowd of people,"The leader of the political party Demokraatit, Jens-Frederik Nielsen is seen among the protesters at a demonstration march ending in front of the U.S. consulate, under the slogan, ""Greenland belongs to the Greenlandic people"", in Nuuk, Greenland, March 15, 2025  Christian Klindt Soelbeck/Ritzau Scanpix/via REUTERS    ",
9.7084757,#TheMoment he was grass in Bad Bunny's Super Bowl halftime show,https://www.cbc.ca/player/play/9.7084757?cmp=rss,Top Stories,2026-02-11 05:56:58,a man smiles behind reeds of tall grass,#TheMoment he was grass in Bad Bunny's Super Bowl half-time show,
9.7084649,DNA breakthrough leads to charges in violent 1992 sexual assault in Alberta town,https://www.cbc.ca/news/canada/edmonton/alta-sex-assault-9.7084649?cmp=rss,Canada,2026-02-11 05:40:52,RCMP tag,RCMP,
9.7084644,"Danielle Smith says 'significant' deficits to come, rules out tax hikes and big cuts",https://www.cbc.ca/news/canada/calgary/alberta-budget-smith-deficits-9.7084644?cmp=rss,Calgary,2026-02-11 05:29:37,a woman with long hair and a blue suit stands in front of flags,"Premier Danielle Smith speaks to the media at the Legislature in Edmonton, on Wednesday, December 10, 2025.",
9.7084375,"FDA refuses Moderna's application for new mRNA flu vaccine, company says",https://www.cbc.ca/news/health/fda-refuses-moderna-vaccine-9.7084375?cmp=rss,Health,2026-02-11 03:22:47," close up of a needle held in blue-gloved hands, extracting the solution into the syringe","A nurse loads a syringe with a vaccine at an inoculation station in Jackson, Miss., Nov. 18, 2022.",
9.7084346,Royal Family sends condolences after Tumbler Ridge mass shooting,https://www.cbc.ca/news/world/tumbler-ridge-world-reaction-9.7084346?cmp=rss,Top Stories,2026-02-11 02:49:25,An elderly man with white hair wearing a suit with a grey tie is pictured.,"King Charles III departs after receiving treatment for an enlarged prostate at The London Clinic on Jan. 29, 2024 in London, England. The King has been receiving treatment for an enlarged prostate, spending three nights at the London Clinic and visited daily by his wife Queen Camilla.",
9.7084213,U.S. House poised to vote against Trump's tariffs on Canada,https://www.cbc.ca/news/world/trump-tariffs-canada-house-representatives-vote-congress-9.7084213?cmp=rss,Top Stories,2026-02-11 02:03:29,"A view of the East Front of the U.S. Capitol, with a police officer in the foreground. ","An officer patrols on the grounds of the U.S. Capitol on Feb. 6, 2026.",
9.7076095,Northern Alberta residents face barriers to blood donation despite urgent need,https://www.cbc.ca/news/canada/edmonton/northern-alberta-blood-drives-shortages-9.7076095?cmp=rss,Health,2026-02-11 01:00:00,,"A nurse hangs up bags of donated blood at a blood donation centre in Lucerne, January 10, 2008. ",
9.708416,U.S. lawmaker Ro Khanna names 6 'powerful men' originally redacted from Epstein files,https://www.cbc.ca/news/world/us-congress-bondi-khanna-epstein-files-9.7084160?cmp=rss,Top Stories,2026-02-11 00:58:49,"Two men in suit and tie speak to microphones outside a building. One is Caucasian and bearded and the other, who is speaking, is brownskinned and cleanshaven.","WASHINGTON, DC - FEBRUARY 09: U.S. Rep. Ro Khanna (D-CA) (R) and Rep. Thomas Massie (R-KY) speak to reporters about the Epstein files outside the offices of the Department of Justice on February 9, 2026 in Washington, DC. Khanna and Massie, the co-authors of the Epstein Files Transparency Act, were permitted to review an unredacted version of the Epstein files today as part of their ongoing investigation. (Photo by Alex Wong/Getty Images)",
9.7084125,FAA lifts closure of airspace over El Paso that had been enacted for 'special security reasons',https://www.cbc.ca/news/world/us-faa-el-paso-airspace-9.7084125?cmp=rss,World,2026-02-10 23:04:32,An airplane that has a Southwest decal on the side is shown on the tarmac with mountains visible in the background.,"A Southwest jet sits at a gate awaiting passengers at the airport in El Paso, Texas, U.S., October 11, 2021 .     ",
9.707843,'I used to trust them': Family shattered after 6-month-old baby dies at Winnipeg Children's Hospital,https://www.cbc.ca/news/canada/manitoba/six-month-old-baby-died-waiting-care-winnipeg-children-hospital-9.7078430?cmp=rss,Health,2026-02-10 23:00:00,A baby boy looks forward while lying in his hospital bed.,Luca Teng spent four months in hospital for continued care after being born with esophagus atresia.,
9.7083218,Veterans Affairs employees pushing back against Ottawa's return-to-office order,https://www.cbc.ca/news/canada/prince-edward-island/pei-veterans-affairs-employees-union-return-to-office-order-9.7083218?cmp=rss,Top Stories,2026-02-10 22:00:00,"The Daniel J MacDonald building in Charlottetown, a brick building with the Canada flag flying.",The Daniel J. MacDonald building in Charlottetown before its major renovations. This building is one of the main offices for Department of Veterans' Affairs employees.,
9.7083436,Why some Canadian companies are turning their workers into owners instead of selling to the U.S.,https://www.cbc.ca/news/canada/calgary/bakx-eot-employee-ownership-trust-capital-gains-exemption-9.7083436?cmp=rss,Business,2026-02-10 21:00:00,A closeup shows a woman's hands on a laptop keyboard in a sunlit room.,A stock photo shows a woman typing on a laptop keyboard.,
9.7083566,"Stellantis keeping 650 staff hired for EV research in Canada, despite broader pullback",https://www.cbc.ca/news/canada/windsor/stellantis-electric-vehicle-windsor-research-battery-nextstar-9.7083566?cmp=rss,Business,2026-02-10 21:00:00,A Chrysler sign in front of a building,"Stellantis’ Automotive Research and Development Centre (ARDC) in Windsor, Ont., on Monday, Feb. 9. 2026.",
9.7080727,Ontario doctor en route to Gaza says he was denied entry to Israel because he was carrying medical items,https://www.cbc.ca/news/canada/kitchener-waterloo/guelph-doctor-denied-gaza-entry-9.7080727?cmp=rss,Top Stories,2026-02-10 21:00:00,Man holds refusal letter,Kapasi holds up the letter from Israel's Border Control Administration saying he was denied entry into Israel.,
9.7083566,"Stellantis keeping 650 staff hired for EV research in Canada, despite broader pullback",https://www.cbc.ca/news/canada/windsor/stellantis-electric-vehicle-windsor-research-battery-nextstar-9.7083566?cmp=rss,Business,2026-02-10 21:00:00,A Chrysler sign in front of a building,"Stellantis’ Automotive Research and Development Centre (ARDC) in Windsor, Ont., on Monday, Feb. 9. 2026.",
9.7083111,"Arviat, Nunavut, chosen as main campus site for Canada's 1st Inuit university",https://www.cbc.ca/news/politics/inuit-nunangat-university-location-9.7083111?cmp=rss,Calgary,2026-02-10 21:00:00,A photo of a shoreline with sea ice and some small houses in the background ,"Arviat, Nunavut, in May 2023. RCMP say they've charged a man in the community with second-degree murder. ",
